{
    "$schema": "http://json-schema.org/draft-04/schema",
    "$id": "latex-tplx",
    "description": "define segments to insert into the the template jinja template of id latex-tplx",
    "outline": {
        "module": "ipypublish.templates.outline_schemas",
        "file": "latex_outline.latex.j2"
    },
    "type": "object",
    "additionalProperties": false,
    "definitions": {
        "append_after": {
            "description": "a segment of the template, each line should be a separate item",
            "type": "array",
            "items": {
                "type": "string"
            }
        }
    },
    "required": [
        "description",
        "identifier",
        "template",
        "segments"
    ],
    "properties": {
        "$schema": {
            "type": "string"
        },
        "identifier": {
            "description": "the identification of the segments",
            "type": "string"
        },
        "description": {
            "description": "the purpose of this group of segments",
            "type": "string"
        },
        "template": {
            "description": "the template identifier",
            "enum": ["latex-tplx"]
        },
        "segments": {
            "additionalProperties": false,
            "description": "the segments to insert",
            "properties": {
                "document_docclass": {
                    "$ref": "#/definitions/append_after"
                },
                "document_packages": {
                    "$ref": "#/definitions/append_after"
                },
                "document_definitions": {
                    "$ref": "#/definitions/append_after"
                },
                "document_margins": {
                    "$ref": "#/definitions/append_after"
                },
                "document_commands": {
                    "$ref": "#/definitions/append_after"
                },
                "document_header_end": {
                    "$ref": "#/definitions/append_after"
                },
                "document_title": {
                    "$ref": "#/definitions/append_after"
                },
                "document_abstract": {
                    "$ref": "#/definitions/append_after"
                },
                "document_predoc": {
                    "$ref": "#/definitions/append_after"
                },
                "document_bibliography": {
                    "$ref": "#/definitions/append_after"
                },
                "document_postdoc": {
                    "$ref": "#/definitions/append_after"
                },
                "notebook_input": {
                    "$ref": "#/definitions/append_after"
                },
                "notebook_input_code": {
                    "$ref": "#/definitions/append_after"
                },
                "notebook_input_raw": {
                    "$ref": "#/definitions/append_after"
                },
                "notebook_input_markdown": {
                    "$ref": "#/definitions/append_after"
                },
                "notebook_input_unknown": {
                    "$ref": "#/definitions/append_after"
                },
                "notebook_output": {
                    "$ref": "#/definitions/append_after"
                },
                "notebook_output_text": {
                    "$ref": "#/definitions/append_after"
                },
                "notebook_output_error": {
                    "$ref": "#/definitions/append_after"
                },
                "notebook_output_traceback": {
                    "$ref": "#/definitions/append_after"
                },
                "notebook_output_stream": {
                    "$ref": "#/definitions/append_after"
                },
                "notebook_output_latex": {
                    "$ref": "#/definitions/append_after"
                },
                "notebook_output_markdown": {
                    "$ref": "#/definitions/append_after"
                },
                "notebook_output_png": {
                    "$ref": "#/definitions/append_after"
                },
                "notebook_output_jpg": {
                    "$ref": "#/definitions/append_after"
                },
                "notebook_output_svg": {
                    "$ref": "#/definitions/append_after"
                },
                "notebook_output_pdf": {
                    "$ref": "#/definitions/append_after"
                },
                "jinja_macros": {
                    "$ref": "#/definitions/append_after"
                }
            }
        },
        "overwrite": {
            "description": "a list of segment keys that may overwrite previously defined entries",
            "type": "array",
            "items": {
                "enum": [
                    "meta_docstring",
                    "document_docclass",
                    "document_packages",
                    "document_definitions",
                    "document_margins",
                    "document_commands",
                    "document_header_end",
                    "document_title",
                    "document_abstract",
                    "document_predoc",
                    "document_bibliography",
                    "document_postdoc",
                    "notebook_input",
                    "notebook_input_code",
                    "notebook_input_raw",
                    "notebook_input_markdown",
                    "notebook_input_unknown",
                    "notebook_output",
                    "notebook_output_text",
                    "notebook_output_error",
                    "notebook_output_traceback",
                    "notebook_output_stream",
                    "notebook_output_latex",
                    "notebook_output_markdown",
                    "notebook_output_png",
                    "notebook_output_jpg",
                    "notebook_output_svg",
                    "notebook_output_pdf",
                    "jinja_macros"
                ]
            }
        }
    }
}