{
  "$schema": "../outline_schema/latex_tplx_schema.json",
  "identifier": "standard-standard_definitions",
  "description": "with standard nbconvert definitions",
  "segments": {
    "document_definitions": [
      "",
      "",
      "% Pygments definitions",
      "((( resources.latex.pygments_definitions )))",
      "",
      "% ANSI colors",
      "\\definecolor{ansi-black}{HTML}{3E424D}",
      "\\definecolor{ansi-black-intense}{HTML}{282C36}",
      "\\definecolor{ansi-red}{HTML}{E75C58}",
      "\\definecolor{ansi-red-intense}{HTML}{B22B31}",
      "\\definecolor{ansi-green}{HTML}{00A250}",
      "\\definecolor{ansi-green-intense}{HTML}{007427}",
      "\\definecolor{ansi-yellow}{HTML}{DDB62B}",
      "\\definecolor{ansi-yellow-intense}{HTML}{B27D12}",
      "\\definecolor{ansi-blue}{HTML}{208FFB}",
      "\\definecolor{ansi-blue-intense}{HTML}{0065CA}",
      "\\definecolor{ansi-magenta}{HTML}{D160C4}",
      "\\definecolor{ansi-magenta-intense}{HTML}{A03196}",
      "\\definecolor{ansi-cyan}{HTML}{60C6C8}",
      "\\definecolor{ansi-cyan-intense}{HTML}{258F8F}",
      "\\definecolor{ansi-white}{HTML}{C5C1B4}",
      "\\definecolor{ansi-white-intense}{HTML}{A1A6B2}",
      "",
      "% commands and environments needed by pandoc snippets",
      "% extracted from the output of `pandoc -s`",
      "\\providecommand{\\tightlist}{%",
      "  \\setlength{\\itemsep}{0pt}\\setlength{\\parskip}{0pt}}",
      "\\DefineVerbatimEnvironment{Highlighting}{Verbatim}{commandchars=\\\\\\{\\}}",
      "% Add ',fontsize=\\small' for more characters per line",
      "\\newenvironment{Shaded}{}{}",
      "\\newcommand{\\KeywordTok}[1]{\\textcolor[rgb]{0.00,0.44,0.13}{\\textbf{{#1}}}}",
      "\\newcommand{\\DataTypeTok}[1]{\\textcolor[rgb]{0.56,0.13,0.00}{{#1}}}",
      "\\newcommand{\\DecValTok}[1]{\\textcolor[rgb]{0.25,0.63,0.44}{{#1}}}",
      "\\newcommand{\\BaseNTok}[1]{\\textcolor[rgb]{0.25,0.63,0.44}{{#1}}}",
      "\\newcommand{\\FloatTok}[1]{\\textcolor[rgb]{0.25,0.63,0.44}{{#1}}}",
      "\\newcommand{\\CharTok}[1]{\\textcolor[rgb]{0.25,0.44,0.63}{{#1}}}",
      "\\newcommand{\\StringTok}[1]{\\textcolor[rgb]{0.25,0.44,0.63}{{#1}}}",
      "\\newcommand{\\CommentTok}[1]{\\textcolor[rgb]{0.38,0.63,0.69}{\\textit{{#1}}}}",
      "\\newcommand{\\OtherTok}[1]{\\textcolor[rgb]{0.00,0.44,0.13}{{#1}}}",
      "\\newcommand{\\AlertTok}[1]{\\textcolor[rgb]{1.00,0.00,0.00}{\\textbf{{#1}}}}",
      "\\newcommand{\\FunctionTok}[1]{\\textcolor[rgb]{0.02,0.16,0.49}{{#1}}}",
      "\\newcommand{\\RegionMarkerTok}[1]{{#1}}",
      "\\newcommand{\\ErrorTok}[1]{\\textcolor[rgb]{1.00,0.00,0.00}{\\textbf{{#1}}}}",
      "\\newcommand{\\NormalTok}[1]{{#1}}",
      "",
      "% Additional commands for more recent versions of Pandoc",
      "\\newcommand{\\ConstantTok}[1]{\\textcolor[rgb]{0.53,0.00,0.00}{{#1}}}",
      "\\newcommand{\\SpecialCharTok}[1]{\\textcolor[rgb]{0.25,0.44,0.63}{{#1}}}",
      "\\newcommand{\\VerbatimStringTok}[1]{\\textcolor[rgb]{0.25,0.44,0.63}{{#1}}}",
      "\\newcommand{\\SpecialStringTok}[1]{\\textcolor[rgb]{0.73,0.40,0.53}{{#1}}}",
      "\\newcommand{\\ImportTok}[1]{{#1}}",
      "\\newcommand{\\DocumentationTok}[1]{\\textcolor[rgb]{0.73,0.13,0.13}{\\textit{{#1}}}}",
      "\\newcommand{\\AnnotationTok}[1]{\\textcolor[rgb]{0.38,0.63,0.69}{\\textbf{\\textit{{#1}}}}}",
      "\\newcommand{\\CommentVarTok}[1]{\\textcolor[rgb]{0.38,0.63,0.69}{\\textbf{\\textit{{#1}}}}}",
      "\\newcommand{\\VariableTok}[1]{\\textcolor[rgb]{0.10,0.09,0.49}{{#1}}}",
      "\\newcommand{\\ControlFlowTok}[1]{\\textcolor[rgb]{0.00,0.44,0.13}{\\textbf{{#1}}}}",
      "\\newcommand{\\OperatorTok}[1]{\\textcolor[rgb]{0.40,0.40,0.40}{{#1}}}",
      "\\newcommand{\\BuiltInTok}[1]{{#1}}",
      "\\newcommand{\\ExtensionTok}[1]{{#1}}",
      "\\newcommand{\\PreprocessorTok}[1]{\\textcolor[rgb]{0.74,0.48,0.00}{{#1}}}",
      "\\newcommand{\\AttributeTok}[1]{\\textcolor[rgb]{0.49,0.56,0.16}{{#1}}}",
      "\\newcommand{\\InformationTok}[1]{\\textcolor[rgb]{0.38,0.63,0.69}{\\textbf{\\textit{{#1}}}}}",
      "\\newcommand{\\WarningTok}[1]{\\textcolor[rgb]{0.38,0.63,0.69}{\\textbf{\\textit{{#1}}}}}",
      "",
      "",
      "% Define a nice break command that doesn't care if a line doesn't already",
      "% exist.",
      "\\def\\br{\\hspace*{\\fill} \\\\* }",
      "",
      "% Math Jax compatability definitions",
      "\\def\\gt{>}",
      "\\def\\lt{<}",
      ""
    ]
  },
  "template": "latex-tplx"
}