{
  "$schema": "../outline_schema/latex_tplx_schema.json",
  "identifier": "standard-standard_article",
  "description": "with standard nbconvert article setup",
  "segments": {
    "document_docclass": [
      "\\documentclass[11pt]{article}"
    ],
    "document_margins": [
      "",
      "\\usepackage{geometry} % Used to adjust the document margins",
      "% Slightly bigger margins than the latex defaults",
      "\\geometry{verbose,tmargin=1in,bmargin=1in,lmargin=1in,rmargin=1in}"
    ],
    "document_packages": [
      "",
      "",
      "\\usepackage[T1]{fontenc} % Nicer default font (+ math font) than Computer Modern for most use cases",
      "\\usepackage{mathpazo}",
      "\\usepackage{graphicx}",
      "\\usepackage{caption}",
      "\\usepackage{adjustbox} % Used to constrain images to a maximum size",
      "\\usepackage{xcolor} % Allow colors to be defined",
      "\\usepackage{enumerate} % Needed for markdown enumerations to work",
      "\\usepackage{amsmath} % Equations",
      "\\usepackage{amssymb} % Equations",
      "\\usepackage{textcomp} % defines textquotesingle",
      "% Hack from http://tex.stackexchange.com/a/47451/13684:",
      "\\AtBeginDocument{%",
      "    \\def\\PYZsq{\\textquotesingle}% Upright quotes in Pygmentized code",
      "}",
      "\\usepackage{upquote} % Upright quotes for verbatim code",
      "\\usepackage{eurosym} % defines \\euro",
      "\\usepackage[mathletters]{ucs} % Extended unicode (utf-8) support",
      "\\usepackage[utf8]{inputenc} % Allow utf-8 characters in the tex document",
      "\\usepackage{fancyvrb} % verbatim replacement that allows latex",
      "\\usepackage{grffile} % extends the file name processing of package graphics",
      "                        % to support a larger range",
      "% The hyperref package gives us a pdf with properly built",
      "% internal navigation ('pdf bookmarks' for the table of contents,",
      "% internal cross-reference links, web links for URLs, etc.)",
      "\\usepackage{hyperref}",
      "\\usepackage{longtable} % longtable support required by pandoc >1.10",
      "\\usepackage{booktabs}  % table support for pandoc > 1.12.2",
      "\\usepackage[inline]{enumitem} % IRkernel/repr support (it uses the enumerate* environment)",
      "\\usepackage[normalem]{ulem} % ulem is needed to support strikethroughs (\\sout)",
      "                            % normalem makes italics be italics, not underlines",
      "",
      "\\usepackage{todonotes} % to mark to-dos"
    ],
    "document_definitions": [
      "",
      "% Colors for the hyperref package",
      "\\definecolor{urlcolor}{rgb}{0,.145,.698}",
      "\\definecolor{linkcolor}{rgb}{.71,0.21,0.01}",
      "\\definecolor{citecolor}{rgb}{.12,.54,.11}",
      "",
      "% Basic figure setup, for now with no caption control since it's done",
      "% automatically by Pandoc (which extracts ![](path) syntax from Markdown).",
      "% We will generate all images so they have a width \\maxwidth. This means",
      "% that they will get their normal width if they fit onto the page, but",
      "% are scaled down if they would overflow the margins.",
      "\\makeatletter",
      "\\def\\maxwidth{\\ifdim\\Gin@nat@width>\\linewidth\\linewidth",
      "\\else\\Gin@nat@width\\fi}",
      "\\makeatother",
      "\\let\\Oldincludegraphics\\includegraphics",
      "% Set max figure width to be 80% of text width, for now hardcoded.",
      "\\renewcommand{\\includegraphics}[1]{\\Oldincludegraphics[width=.8\\maxwidth]{#1}}",
      "% Ensure that by default, figures have no caption (until we provide a",
      "% proper Figure object with a Caption API and a way to capture that",
      "% in the conversion process - todo).",
      "\\DeclareCaptionLabelFormat{nolabel}{}",
      "\\captionsetup{labelformat=nolabel}",
      ""
    ],
    "document_header_end": [
      "",
      "% clereref must be loaded after anything that changes the referencing system",
      "\\usepackage{cleveref}",
      "\\creflabelformat{equation}{#2#1#3}"
    ],
    "document_commands": [
      "",
      "% Prevent overflowing lines due to hard-to-break entities",
      "\\sloppy",
      "% Setup hyperref package",
      "\\hypersetup{",
      "    breaklinks=true,  % so long urls are correctly broken across lines",
      "    colorlinks=true,",
      "    urlcolor=urlcolor,",
      "    linkcolor=linkcolor,",
      "    citecolor=citecolor,",
      "    }",
      ""
    ],
    "document_title": [
      "",
      "\\title{((( resources.metadata.name | ascii_only | escape_latex )))}",
      "\\maketitle"
    ]
  },
  "template": "latex-tplx"
}