{
  "$schema": "../outline_schema/latex_tplx_schema.json",
  "identifier": "standard-standard_packages",
  "description": "with standard nbconvert packages",
  "segments": {
    "document_packages": [
      "",
      "",
      "\\usepackage[T1]{fontenc} % Nicer default font (+ math font) than Computer Modern for most use cases",
      "\\usepackage{mathpazo}",
      "\\usepackage{graphicx}",
      "\\usepackage[skip=3pt]{caption}",
      "\\usepackage{adjustbox} % Used to constrain images to a maximum size",
      "\\usepackage[table]{xcolor} % Allow colors to be defined",
      "\\usepackage{enumerate} % Needed for markdown enumerations to work",
      "\\usepackage{amsmath} % Equations",
      "\\usepackage{amssymb} % Equations",
      "\\usepackage{textcomp} % defines textquotesingle",
      "% Hack from http://tex.stackexchange.com/a/47451/13684:",
      "\\AtBeginDocument{%",
      "    \\def\\PYZsq{\\textquotesingle}% Upright quotes in Pygmentized code",
      "}",
      "\\usepackage{upquote} % Upright quotes for verbatim code",
      "\\usepackage{eurosym} % defines \\euro",
      "\\usepackage[mathletters]{ucs} % Extended unicode (utf-8) support",
      "\\usepackage[utf8x]{inputenc} % Allow utf-8 characters in the tex document",
      "\\usepackage{fancyvrb} % verbatim replacement that allows latex",
      "\\usepackage{grffile} % extends the file name processing of package graphics",
      "                        % to support a larger range",
      "% The hyperref package gives us a pdf with properly built",
      "% internal navigation ('pdf bookmarks' for the table of contents,",
      "% internal cross-reference links, web links for URLs, etc.)",
      "\\usepackage{hyperref}",
      "\\usepackage{longtable} % longtable support required by pandoc >1.10",
      "\\usepackage{booktabs}  % table support for pandoc > 1.12.2",
      "\\usepackage[inline]{enumitem} % IRkernel/repr support (it uses the enumerate* environment)",
      "\\usepackage[normalem]{ulem} % ulem is needed to support strikethroughs (\\sout)",
      "                            % normalem makes italics be italics, not underlines",
      ""
    ]
  },
  "template": "latex-tplx"
}